{
  "schema_version": 2,
  "task_id": "runtime-0014-kcl",
  "canonical_substance_id": "kcl",
  "formula_key": "KCl",
  "submitted_by": {"model": "glm", "agent_id": "glm-web-5828d4ba"},
  "result_type": "FOUND",
  "candidate": {"provider": "Wikimedia Commons", "source_page_url": "https://commons.wikimedia.org/wiki/File:KCl_7.45%25.jpg", "download_url": "https://upload.wikimedia.org/wikipedia/commons/1/1a/KCl_7.45%25.jpg", "file_title": "File:KCl 7.45%.jpg", "author": "Pavel Dušek", "license": "CC BY 4.0", "license_url": "https://creativecommons.org/licenses/by/4.0/"},
  "assessment": {"confidence": 0.9, "exact_substance_match": true, "real_photo": true, "watermark_free": true, "open_license": true, "visual_form": "solution (glass infusion vial)", "species_class": "solution", "match_notes": "File:KCl 7.45%.jpg is a real photograph of a labeled potassium chloride solution vial (B. Braun Kaliumchlorid 7,45%). The task requires KCl in the solution state, and this image shows exactly that: an aqueous KCl solution, visually verified as a colorless clear liquid in a glass vial whose label reads 'KCl 7.45%'. The Commons description explicitly states 'potassium chloride 7.45% solution' and the file is categorized under Potassium chloride and Solutions. License is CC BY 4.0 with named author Pavel Dusek (imported from WikiSkripta, Czech medical education wiki); the file carries a pending Commons license-review tag, which is a routine procedural check for WikiSkripta imports rather than a dispute - the author and license declaration are clear. 7.45% (~1 M) is an ordinary dilute-to-moderate solution concentration, honestly representing KCl(aq).", "identity_checks": ["Commons file description explicitly states 'potassium chloride 7.45% solution'", "Vial label visually verified to read 'KCl 7.45%' / 'Kaliumchlorid B. Braun 7,45%'", "State match: task state is solution; the image shows an aqueous KCl solution, not solid KCl/sylvite", "Categories confirm Potassium chloride and Solutions", "Liquid visually verified colorless and clear - consistent with aqueous KCl", "No watermark detected in visual inspection"]},
  "search_audit": {"queries_used": ["potassium chloride solution", "potassium chloride", "File:KCl 7.45%.jpg (file page + label verification)"], "sources_checked": ["https://commons.wikimedia.org/wiki/File:KCl_7.45%25.jpg", "https://commons.wikimedia.org/wiki/Category:Potassium_chloride"], "rejected_candidates": [{"url": "https://commons.wikimedia.org/wiki/File:Potassium_chloride.jpg", "reason": "Walkerma PD photo of solid KCl pellets - solid state, while the task requires the solution state."}, {"url": "https://commons.wikimedia.org/wiki/File:Potassium_chloride_podwer.jpg", "reason": "Solid KCl powder - state mismatch."}, {"url": "https://commons.wikimedia.org/wiki/File:Chlorid_draseln%C3%BD.JPG", "reason": "Solid KCl reagent bottle - state mismatch."}, {"url": "https://commons.wikimedia.org/wiki/File:Compacted_potassium_chloride,_fertilizer_grade.jpg", "reason": "Solid fertilizer-grade KCl - state mismatch."}, {"url": "https://commons.wikimedia.org/wiki/File:Potassium_chloride_(2).JPG", "reason": "Solid sample photo - state mismatch."}, {"url": "https://commons.wikimedia.org/wiki/File:Cristaux_KCl.jpg", "reason": "KCl crystals - solid state, mismatch with the solution task."}]}
}
